{
  "Base": {
    "Name": "Base",
    "Description": "TaesLab Toolbox Base Functions",
    "Groups": [
      {
        "Name": "rdmb",
        "Description": "Read Data Models",
        "Files": [
          {
            "Name": "ReadDataModel",
            "Description": "Read and validate a thermoeconomic data model file."
          },
          {
            "Name": "ValidateModelTables",
            "Description": "Validate and convert tabular data model files."
          },
          {
            "Name": "CopyDataModel",
            "Description": "Copy and convert a data model file to a different format."
          },
          {
            "Name": "ImportDataModel",
            "Description": "Load a cDataModel object from a MAT file."
          },
          {
            "Name": "ImportData",
            "Description": "Import external tabular data from CSV or Excel files."
          }
        ]
      },
      {
        "Name": "trb",
        "Description": "Thermoeconomic Results",
        "Files": [
          {
            "Name": "ThermoeconomicModel",
            "Description": "Create a cThermoeconomicModel object from a data model."
          },
          {
            "Name": "ProductiveStructure",
            "Description": "Extract and display productive structure information from a data model."
          },
          {
            "Name": "ProductiveDiagram",
            "Description": "Generate graph adjacency tables for productive structure visualization."
          },
          {
            "Name": "ExergyAnalysis",
            "Description": "Perform exergy analysis for a specific plant operating state."
          },
          {
            "Name": "ThermoeconomicAnalysis",
            "Description": "Perform thermoeconomic cost analysis of a plant operating state."
          },
          {
            "Name": "ThermoeconomicDiagnosis",
            "Description": "Detect and quantify malfunctions by comparing plant operating states."
          },
          {
            "Name": "DiagramFP",
            "Description": "Generate annotated fuel-product diagrams with exergy flows and costs."
          },
          {
            "Name": "WasteAnalysis",
            "Description": "Analyze waste cost allocation and recycling optimization strategies."
          },
          {
            "Name": "SummaryResults",
            "Description": "Generate comparative summary tables across multiple operating conditions."
          }
        ]
      },
      {
        "Name": "srb",
        "Description": "Save Results",
        "Files": [
          {
            "Name": "SaveDataModel",
            "Description": "Save thermoeconomic data model to file in various formats."
          },
          {
            "Name": "SaveResults",
            "Description": "Export result tables to file in multiple formats."
          },
          {
            "Name": "SaveSummary",
            "Description": "Export summary comparison tables for multiple states or cost samples."
          },
          {
            "Name": "SaveTable",
            "Description": "Export a single table to file in various formats."
          }
        ]
      },
      {
        "Name": "drb",
        "Description": "Display Results",
        "Files": [
          {
            "Name": "ListResultTables",
            "Description": "Display catalog of available result tables and their properties."
          },
          {
            "Name": "ShowGraph",
            "Description": "Display graphical visualizations of thermoeconomic analysis results."
          },
          {
            "Name": "ShowResults",
            "Description": "Display and save result tables from thermoeconomic analyses."
          },
          {
            "Name": "ShowTable",
            "Description": "Display, export, and save individual result tables."
          },
          {
            "Name": "ExportResults",
            "Description": "Export result tables to various MATLAB data formats."
          }
        ]
      },
      {
        "Name": "guib",
        "Description": "GUI Functions",
        "Files": [
          {
            "Name": "TaesTool",
            "Description": "Compatible user interface App for MATLAB/Octave."
          },
          {
            "Name": "TaesPanel",
            "Description": "Graphical user interface for selecting thermoeconomic model parameters."
          },
          {
            "Name": "ResultsPanel",
            "Description": "Graphical user interface for displaying results interactively."
          },
          {
            "Name": "ViewResults",
            "Description": "MATLAB app for displaying results tables."
          }
        ]
      }
    ]
  },
  "Functions": {
    "Name": "Functions",
    "Description": "TaesLab Toolbox Utility Functions",
    "Groups": [
      {
        "Name": "ief",
        "Description": "Import/Export Functions",
        "Files": [
          {
            "Name": "exportCSV",
            "Description": "Export cell array to CSV file."
          },
          {
            "Name": "exportJSON",
            "Description": "Export MATLAB structure to JSON file."
          },
          {
            "Name": "exportMAT",
            "Description": "Export cTaesLab object to MAT file."
          },
          {
            "Name": "importCSV",
            "Description": "Import CSV file contents as cell array."
          },
          {
            "Name": "importJSON",
            "Description": "Import JSON file and parse into MATLAB structure."
          },
          {
            "Name": "importMAT",
            "Description": "Import cTaesLab object from MAT file."
          }
        ]
      },
      {
        "Name": "vf",
        "Description": "Validation Functions",
        "Files": [
          {
            "Name": "isFilename",
            "Description": "Validate if a filename is acceptable for read/write operations."
          },
          {
            "Name": "isIndex",
            "Description": "Check if an integer value is within a valid index range."
          },
          {
            "Name": "isInteger",
            "Description": "Check if the value is an integer number."
          },
          {
            "Name": "isMatlab",
            "Description": "Identifies if the function has been executed in MATLAB."
          },
          {
            "Name": "isNonNegativeMatrix",
            "Description": "Check if the matrix is square and non-negative."
          },
          {
            "Name": "isObject",
            "Description": "Check if 'obj' is a valid cTaesLab object belong to a specific class."
          },
          {
            "Name": "isOctave",
            "Description": "Identifies if the function has been executed in Octave."
          },
          {
            "Name": "isProductiveMatrix",
            "Description": "Check if a matrix represents a productive matrix."
          },
          {
            "Name": "isSquareMatrix",
            "Description": "Check if input is a numeric or logical square matrix."
          },
          {
            "Name": "isValid",
            "Description": "Check if 'obj' is a valid TaesLab object."
          }
        ]
      },
      {
        "Name": "mof",
        "Description": "Matrix Operation Functions",
        "Files": [
          {
            "Name": "divideCol",
            "Description": "Divide each column of matrix A by corresponding element of vector x."
          },
          {
            "Name": "divideRow",
            "Description": "Divide each row of matrix A by corresponding element of vector x."
          },
          {
            "Name": "inverseMatrixOperator",
            "Description": "Calculate the inverse of the M-Matrix (I-A)."
          },
          {
            "Name": "logicalMatrix",
            "Description": "Convert numeric matrix to logical with zero tolerance."
          },
          {
            "Name": "npinv",
            "Description": "Compute inverse of M-matrix (I - A) using Gauss-Jordan elimination."
          },
          {
            "Name": "scaleCol",
            "Description": "Multiply each column of matrix A by corresponding element of vector x."
          },
          {
            "Name": "scaleRow",
            "Description": "Multiply each row of matrix A by corresponding element of vector x."
          },
          {
            "Name": "similarDemandMatrix",
            "Description": "Transform resource-driven matrix to demand-driven form."
          },
          {
            "Name": "similarDemandOperator",
            "Description": "Convert resource-driven operator to demand-driven operator."
          },
          {
            "Name": "similarResourceMatrix",
            "Description": "Compute resource-driven matrix from demand-driven matrix."
          },
          {
            "Name": "similarResourceOperator",
            "Description": "Compute resource-driven operator from demand-driven operator."
          },
          {
            "Name": "tolerance",
            "Description": "Compute relative tolerance value for a matrix."
          },
          {
            "Name": "vDivide",
            "Description": "Element-wise division with NaN handling for 0/0 cases."
          },
          {
            "Name": "zerotol",
            "Description": "Set matrix values near zero to exact zero."
          }
        ]
      },
      {
        "Name": "top",
        "Description": "Graph Functions",
        "Files": [
          {
            "Name": "dfs",
            "Description": "Depth-First Search traversal of a graph"
          },
          {
            "Name": "topologicalOrder",
            "Description": "Get topological order indices of a DAG."
          },
          {
            "Name": "transitiveClosure",
            "Description": "Compute the transitive closure of a directed graph."
          }